id;title;description
114;"The Latest: NTSB says Benadryl impaired balloon operator";"AUSTIN, Texas (AP) - The Latest on a federal investigation into a 2016 Texas hot air balloon crash that killed 16 people, the worst disaster of its kind in..."
115;"UnitedHealth beats 3Q forecasts, helped by Optum growth";"UnitedHealth Group's third-quarter earnings soared 26 percent to beat Wall Street expectations as the nation's largest health insurer sold more coverage to..."
116;"911 calls show Irma chaos as nursing home residents died";"In the calls, employees of the Rehabilitation Center in Hollywood, Florida, can be heard struggling to remember its phone number, describing symptoms and relaying information."
117;"Self-driving cars could ease traffic, but increase sprawl";"BOSTON (AP) - A new study inspired by Boston's early experiments with self-driving cars finds that the technology could ease congestion, but might also lead..."
118;"Man who stabbed refugee and cut off his penis convicted of murder";"The murder took place hours after Barry, who has paranoid schizophrenia, was released from a psychiatric hospital."
119;"Brexit standoff over EU's demands for bigger divorce bill";"The Foreign Secretary vowed defiance as tensions rose again despite the PM's attempt to win support from Jean-Claude Juncker over dinner last night."
120;"Irish rugby stars arrive at court to face rape claims";"Paddy Jackson, 25, and Stuart Olding, 24, are accused of raping the same woman at a property in south Belfast, during June last year. Both men deny all charges against them."
121;"Man is hit by a big window which falls from a Moscow flat";"These are the amazing scenes as a man escaped relatively unscathed after he was struck on the head by the large pane of glass in Moscow which went on to hit the baby's pram who escaped without injury."
122;"Plymouth wife 'threw kettle of water over husband's lover";"Monika Fourie threw scolding water from a cup and a kettle over love rival Hannah Stokes after walking in on her and her Royal Marine husband Wouter, at their marital home in Plymouth, Devon."
123;"'Yes' campaign soars in the gay marriage polls";"The campaign in favour of gay marriage has surged in the polls, leaving the 'No' camp leaving three in every four remaining votes to win the survey."
124;"Man claims fellow passenger urinated on him on United jet";"Daniel Card claimed a fellow passenger exposed himself and began urinating on the United Airlines flight as it prepared to take off from Los Angeles International Airport, pictured."
125;"Newcastle fans hope Mike Ashley sale can help progress";"It was announced on Monday evening that the billionaire businessman wants a sale before Christmas as he prepares to end his controversial decade-long stay on Tyneside."
126;"Laura Dern poses with her two kids and mother Diane Ladd";"The leggy wonder was seen in a very rare image with her mother, acting legend Diane Ladd, 81, as well as the two children she had with singer Ben Harper."
127;"Brittany Packnett reveals how to put on your bra";"Activist and writer Brittany Packnett alerted her Twitter followers after reading a label on a new bra from San Francisco based ThirdLove that indicated the correct way to don a bra."
128;"Roman Polanski's rape victim Samantha Geimer forgives him";"Samantha Geimer, now 54, said her rape at the hands of Roman Polanski in 1977 'did not affect me greatly' and she feels more traumatized by the ongoing court case against him."
129;"'Yes' vote clearly ahead in same-sex marriage plebiscite";"Although the result won't be officially announced until November 15, a 'snap poll' by Roy Morgan revealed that 61.5 per cent of Aussies have voted Yes in the same-sex marriage plebiscite."
130;"Green and clean but is your electric car free of slavery?";"By Belinda GoldsmithLONDON, Oct 17 (Thomson Reuters Foundation) - Electric  vehicles are often labelled the ""green cars"" of the future but  rising demand for..."
131;"China's CEFC eyes big league with Rosneft oil offtake deal";"By Chen Aizhu and Olga YagovaBEIJING/MOSCOW, Oct 17 (Reuters) - As part of its recent  $9.1 billion investment in Russian oil giant Rosneft,  little-known..."
132;"Leicester sack manager Shakespeare - reports";"LONDON, Oct 17 (Reuters) - Leicester City manager Craig Shakespeare was sacked on Tuesday four months after he was put in permanent charge of the Premier..."
133;"CANADA STOCKS-TSX advances as Bombardier leaps on Airbus deal, financials rise";"TORONTO, Oct 17 (Reuters) - Canada's main stock index rose  on Tuesday, led by a more than 20 percent surge in Bombardier  Inc shares and higher financial..."
134;"Queen Letizia of Spain stuns in a floral chiffon frock";"The Spanish queen consort, 45, channelled autumnal chic in a green chiffon dress paired with berry suede shoes as she met with representatives from medical and agricultural organisations."
135;"Man poses with deer for Instagram snaps in London";"Witnesses said the man appeared to be 'trying to get photos for Instagram' as he posed with a herd of up to 50 deer at Richmond Park, London, during the animals' volatile rutting season."
136;"Britain reports hate crimes spike after Brexit vote, attacks";"LONDON (AP) - U.K. authorities say hate crimes spiked after Britain's vote to leave the European Union and following several extremist attacks this year,..."
137;"12 Turkish police officers wounded in bombing";"ANKARA, Turkey (AP) - A bomb exploded as a bus carrying police was passing by in a southern Turkish city on Tuesday, wounding a dozen officers, officials..."
138;"Oops! Actor Bill Pullman accepts, then breaks film award";"KINGSTON, N.Y. (AP) - Bill Pullman is a bit of a klutz when it comes to holding onto a film award.The ""Independence Day"" actor was the recipient of the..."
139;"TOWIE's Tommy Mallett films scenes with Georgia Kousoulou";"The 25-year-old grinned as he chatted away to girlfriend Georgia Kousoulou during lunch at a health food cafe in Brentwood, Essex, with their co-stars."
140;"6 killed in Turkey coal mine collapse";"ANKARA, Turkey (AP) - A coal mine collapsed in southeast Turkey on Tuesday, killing at least six miners. Rescuers were trying to reach one other mine worker..."
141;"Chris Froome claims Velo d'Or after Tour de France victory";"Froome enjoyed a spectacular year, becoming the third man to complete the Tour-Vuelta double in the same season, after Jacques Anquetil in 1963 and Bernard Hinault in 1978."
142;"Gigi Hadid attends All I See Is You screening in NYC";"Hello sunshine! Gigi Hadid dazzles in midriff-revealing yellow dress at screening of new Blake Lively film All I See Is You in NYC on Monday one week after paying tribute to baby sister Bella"
143;"David Walliams receives an OBE amid row with Matt Lucas";"Walliams starred in BAFTA nominated series Little Britain, is a judge on Britain's Got Talent, has released 10 children's books and in 2011 raised more than £2 million for Sports Relief."
144;"ISIS execution site in Raqqa is captured by US-led forces";"US-backed militias in Syria say the jihadists' stronghold of Raqqa has  been liberated after a bloody four-month battle and the city is now being searched for land mines and ISIS sleeper cells."
145;"Filming of Empire put juvenile jail on lockdown for days";"Fox is being sued by inmates at the Cook County Juvenile Temporary Detention Center in Chicago over issues that happened when they filmed Empire in the summer of 2015."
146;"UN-backed Libya talks hit new snag";"Talks between representatives of rival authorities in strife-torn Libya have hit a new snag after a parliamentary delegation suspended its participation in..."
147;"Genes that cause OCD identified by scientists";"The findings confirm suspicions that the  condition – suffered by David Beckham – is genetic, found a study by The Broad Institute in Cambridge, Massachusetts, in the US."
148;"Duchess of Cambridge expecting third child in April";"In a statement released today, the Palace revealed that the Duke and Duchess of Cambridge are 'delighted' to be expecting their third child in April next year."
149;"Neil DeGrasse Tyson says Jack should have tried to survive";"Could Jack have survived in the Titanic? A question that has been discussed on and off since the movie's release in 1997."
150;"Land Rover almost runs down pedestrian in Canberra";"Dashcam footage has captured the incredible moment a car drives up onto a footpath in Canberra, narrowly missing a cyclist before re-entering traffic at high speed."
151;"Ex-soccer star ""King George"" nears goal of Liberia presidency";"By Edward McAllisterMONROVIA, Oct 17 (Reuters) - George Weah has been here  before: on the goal line of the Liberian presidency, one run-off  vote from..."
152;"Nigeria looks to food exports to boost FX income after oil shock";"By Chijioke OhuochaABUJA, Oct 17 (Reuters) - Nigeria is looking to boost  agricultural exports to earn more hard currency, and aims to cut  imports of rice..."
153;"Middlesex relegated after losing appeal against points deduction";"Oct 17 (Reuters) - Middlesex will be relegated from the County Championship First Division after losing their appeal against a points deduction in a match,..."
154;"Storm Ophelia washes up killer jellyfish on UK beaches";"Lethal Portuguese man o' war with 12ft-long tentacles have been appearing in Devon, Hampshire and Dorset as well as on 31 separate beaches along the coast of Wales."
155;"Disorderly Brexit risks crippling UK economy OECD warns";"The Organisation for Economic Co-operation and Development (OECD) warned that leaving the bloc without a deal is a threat to the economy."
156;"Storm Ophelia victims from Ireland identified";"Families paid tribute to road traffic victims Clare O'Neill (pictured) and Fintan Goss, 33, as well as 31-year-old Michael Pyke, who died in a horrific chainsaw accident in Co Tipperary."
157;"Barcelona have Napoli's Kalidou Koulibaly on their radar";"The Nou Camp club are keen on improving their defence during the January transfer window and Koulibaly is regarded as one of their priority targets, according to Mundo Deportivo ."
158;"Austria's Kurz would join growing lineup of young leaders";"Austrian Foreign Minister Sebastian Kurz is set to become Europe's youngest leader after his right-wing party won a general election Sunday. Kurz turned 31..."
159;"Six fishermen feared dead after trawler capsized in Qld";"Searches by sea and air for six missing fisherman have been suspended, fading hopes the men will return to land alive after their trawler capsized off the coast of Queensland on Monday night."
160;"Grand Hotel Continental is the Sistine Chapel of hotels";"The Sistine Chapel is home to the world's most famous ceiling. But Italy also has the next best thing: The Grand Hotel Continental in Siena, which boasts epic frescos of its own."
161;"Microsoft rolls out new Windows 10 update and laptops";"Microsoft has begun rolling out an update to its Windows 10 operating system, hoping to spark enthusiasm for its virtual- and augmented-reality ambitions.The..."
162;"Ex-BBC producer 'fled across roof during London drug raid'";"Alexander Parkin stashed more than £13,000 worth of drugs - including crystal meth, ecstasy and GBL - and offered them for sale at his fourth fourth-floor flat in Manchester Street, Marylebone, it is claimed."
163;"Trump says drug czar nominee Tom Marino is 'withdrawing'";"'Rep. Tom Marino has informed me that he is withdrawing his name from consideration as drug czar. Tom is a fine man and a great Congressman!' the president tweeted."
164;"America Ferrara says she was sexually abused aged nine";"Ferrera, 33, said she lived with 'shame and guilt' over the attack for years afterwards and had to regularly see her abuser, who smiled and waved at her, 'expecting me to shut my mouth and smile back.'"
165;"Tanzanian opposition figure out of intensive care after attack";"Tanzanian opposition figure Tundu Lissu, who was shot and critically injured at his home last month, is now out of intensive care, his party CHADEMA said..."
166;"Sacked Anthony Scaramucci brands Trump 'political genius'";"Donald Trump's former communications chief who was axed after just 11 days, said the President is a 'political genius' who won the election by using Twitter when he spoke at at the Oxford Union."
167;"Chelsea cannot lose again in Premier League: Marcos Alonso";"The Blues, who play Roma in the Champions League on Wednesday night, lost 2-1 at bottom club Crystal Palace last Saturday."
168;"EuroMillions winner Jane Park bags herself football star";"The 21-year-old spent the weekend meeting Jordan's parents and enjoying a carvery in Dudley. The couple packed on the PDA as they were spotted together after going public in September."
169;"Type 2 diabetes breakthrough";"Leicester Diabetes Centre experts found semaglutide helped 71 per cent of patients shed pounds - it is believed this is the first type 2 diabetes pill to instigate weight loss. It also halts the condition."
170;"Sean Hughes wrote poignant poem about his own death";"Comedian Sean Hughes revealed how he wanted to have his ashes 'scattered in a bar' in a poignant poem he wrote about his own death 13 years ago."
171;"SPECIAL REPORT-They fled danger for a high-stakes bet on U.S. immigration courts";"By Mica Rosenberg, Reade Levinson and Ryan McNeillOAKLAND, California, Oct 17 (Reuters) - The two Honduran  women told nearly identical stories to the..."
172;"Activist RBR courts fellow investors for Credit Suisse break-up";"By John Revill, Oliver Hirt and Joshua FranklinZURICH, Oct 17 (Reuters) - Activist investor RBR Capital  Advisors sought on Tuesday to rally support for a..."
173;"Capital rules 'exacerbating' clearing house risks -CFTC commissioner";"By Michelle PriceWASHINGTON, Oct 17 (Reuters) - Bank capital rules are  concentrating risk inside the clearing system and making  clearing houses..."
174;"Brexit divisions resurface as minister says no deal is 'unthinkable'";"LONDON, Oct 17 (Reuters) - British interior minister Amber  Rudd said on Tuesday it was ""unthinkable"" that Britain and the  European Union would fail to get..."
175;"Mission impossible? Merkel's coalition conundrum just got harder";"By Paul CarrelBERLIN, Oct 17 (Reuters) - She has earned a reputation as  Europe's chief crisis manager. Now Germany's Angela Merkel must  forge a government..."
176;"EU business leaders urge Britain to hasten pace in Brexit talks";"BRUSSELS, Oct 17 (Reuters) - European employers group  BusinessEurope urged the British government on Tuesday to speed  up negotiations with the European..."
177;"Cobie Frost's boyfriend is MKR Della Muscat's ex-husband";"Daily Mail Australia can exclusively reveal the identity of Bachelor reject Cobie Frost's new mystery man as being Chris Whearty, the former husband of My Kitchen Rules star Della Muscat."
178;"'Weinstein tried to ""teach"" Vietnamese actress sex scenes'";"Vu Thong Phuong, 32, met Weinstein in Saigon in 2008 to discuss her small role in the film Shanghai when she said he appeared in his presidential suite 'smiling' in a towel."
179;"Canary island La Palma sees 352 earthquakes in ten days";"Scientists are now monitoring the seismic activity on the island of La Palma 24 hours per day, and are set to carry out tests on the slopes of the island's active volcano - Cumbre Vieja."
180;"Chelsea train with Alvaro Morata in their ranks for Roma";"Alvaro Morata is training with Chelsea on the eve of their Champions League clash with Roma in a significant boost to Antonio Conte's shell-shocked side."
181;"325-pound woman charged with killing girl by sitting on her";"PENSACOLA, Fla. (AP) - A 325-pound (150-kilogram) Florida woman is charged with killing her 9-year-old cousin by sitting on the child as punishment.Veronica..."
182;"Richard Hannon-trained Barney Roy gears up for Asco";"On Saturday, he will walk through the gates at Ascot with his head high ready to saddle a runner in Barney Roy with a leading chance of landing the feature £1.3million Champion Stakes."
183;"Adelaide mother claims son was sexually assaulted by boy";"A mother claims a young boy sexually abused her five-year-old son behind a shed while they were at an Adelaide kindergarten together."
184;"Bill Murray helps couple announce pregnancy in Chicago";"Bill Murray was out and about in Chicago last week, were the Oscar-nominated actor caught the Cubs take on the Washington Nationals in the National League Divisional Series."
185;"Zuma fires critic in S.Africa reshuffle";"South African President Jacob Zuma sacked a vocal critic from his cabinet on Tuesday, a move set to deepen tensions before the ANC chooses a new party leader..."
186;"Pennsylvania college offers cut players reinstatement";"Three football players who were cut from the team at Division III Albright College in Pennsylvania have been offered reinstatement. One was cut for kneeling during the national anthem."
187;"Sam Wood shares photo of newborn daughter Willow";"Last week, former Bachelor stars Sam Wood and fiancée Snezana Markoski, welcomed their daughter Willow Wendy into the world."
188;"Gerard Butler speaks about terrifying LA motorbike crash";"The 47-year-old explained he was lucky to come away with only a fractured foot and a few bruises, as the crash sent him 'flying through the air' and could have easily 'taken him out'."
189;"Manchester holidaymaker banned from easyJet for five years";"Engineer Paul Brady, 39, of Droylsden, Greater Manchester, was detained after he and his partner Loretta Moran, 34, got drunk on lager as they were about to board a jet to Copenhagen."
190;"U.S. Justice Dept will review new law's impact on DEA powers -official";"WASHINGTON, Oct 17 (Reuters) - U.S. Deputy Attorney General  Rod Rosenstein said on Tuesday he was very concerned about a  report that said new legislation..."
191;"India orders Delhi power plant, generator shutdown as air worsens";"By Tommy WilkesNEW DELHI, Oct 17 (Reuters) - The Indian government ordered  diesel generators and a power plant in Delhi to be shut down on  Tuesday as air..."
192;"Soccer-Italy to face Sweden in World Cup playoff";"By Brian HomewoodZURICH, Oct 17 (Reuters) - Four-times world champions Italy were given a tough draw against Sweden on Tuesday in their two-legged playoff..."
193;"Goldman offers buyback, dividend details for first time";"NEW YORK, Oct 17 (Reuters) - Goldman Sachs Group Inc  offered investors a window into its capital plans for the first  time, detailing the bank's regulatory..."
194;"Britain's top firms fail to tackle slavery with 'tick box' culture";"By Umberto BacchiLONDON, Oct 17 (Thomson Reuters Foundation) - The majority  of Britain's biggest firms have taken a ""tick box"" approach to a  landmark..."
195;"Missouri team makes shot from other side of the court";"A recreational basketball team in Missouri shocked fans and the other team when they made a shot from the other side of the court."
196;"Mumsnet users enter debate over pyjamas on the school run";"A mother took to to Mumsnet to ask whether it's acceptable to wear your nightwear on the school run - and she received nearly 300 responses."
197;"North Korea warns nuclear war 'may break out any moment'";"North Korea said the 'entire US mainland is within our firing range' and threatened 'severe punishment' for America if it 'dares to invade out sacred territory'."
198;"California woman stole from fire evacuees in Santa Rosa";"Police identified suspect Katie Lehnhard, 31, after a fire victim reported fraudulent charges on her bank account and a cancelled check led police to the parolee from Petaluma, California."
199;"Afghan officials: Taliban wave of attacks kills at least 74";"KABUL, Afghanistan (AP) - The Taliban unleashed a wave of attacks across Afghanistan on Tuesday, targeting police compounds and government facilities with..."
200;"Delaware indicts 18 inmates in deadly prison riot";"DOVER, Del. (AP) - Delaware has indicted eighteen inmates in a deadly riot and hostage-taking at the state's maximum-security prison, most of them on murder..."
201;"Trump says he's 'close' to naming new HHS nominee";"WASHINGTON (AP) - President Donald Trump says he's ""more than close"" to naming a new health and human services secretary.But Trump tells Fox News Radio's..."
202;"Paul 'Fatty' Vautin joked Erin Molan would take his job";"Axed NRL Footy Show veteran Paul 'Fatty' Vautin predicted co-star Erin Molan's rise to fame, after previously hinting he would have to watch his back as the 'talent' could one day take his job."
203;"Lorde wears a racy number in Berlin for her Melodrama tour";"New Zealand songstress Lorde took to the stage in Berlin on Sunday night wearing a racy number as she continued her Melodrama world tour."
204;"Police in Belfast desperately search for missing mother";"A missing Belfast woman who sparked a desperate police search after posting a cryptic Facebook post has been found alive following a public appeal, police have confirmed"
205;"Wanted: Zimbabwe hangman -- 50 people apply";"At least 50 people want to become Zimbabwe's hangman, a job that fell vacant over a decade ago, officials said Tuesday, stressing that applicants were ""very..."
206;"Keith Lemon transforms into It clown Pennywise";"Keith Lemon was more demonic than comedic as he drove fans wild with his Celebrity Juice Halloween transformation."
207;"Qantas unveils the new Dreamliners to fly Perth to Paris";"Perth has been earmarked as a potential travel hub between Europe and Australia, with non-stop Qantas flights to Paris and Germany a very real future possibility."
208;"Rescuers save 200lbs tortoise from Napa, California fires";"A video shows the moment four rescuers save a 200 pound 85-year-old tortoise from the California wildfires. They moved the animal onto a tarp and then to a wheelbarrow."
209;"Transgender footy player refused permission to play AFLW";"Transgender footy player Hannah Mouncey has been refused permission to play in the women's league. She formerly represented Australia in men's handball, is 190cm tall and weighs 100kg."
210;"Britain's May to address EU leaders on Brexit on Thursday";"BRUSSELS, Oct 17 (Reuters) - British Prime Minister Theresa  May will address her European Union peers on her strategy for  Britain's exit from the EU at a..."
211;"Google to be anchor tenant at Toronto innovation hub - government source";"By Andrea HopkinsTORONTO, Oct 17 (Reuters) - Alphabet Inc, the  owner of Google, will be the anchor tenant at a site being  developed on Toronto's waterfront..."
212;"Ireland rugby internationals to stand trial over rape charges";"BELFAST, Oct 17 (Reuters) - Two Ireland rugby internationals accused of raping a woman in Belfast last year will stand trial over the charges, a Northern..."
213;"Graham Norton lists his best and worst interviewees";"Irish television presenter Graham Norton, 54, reveals his noteworthy celebrity interviews, in Wednesday's The Daily Telegraph."
214;"Trump's claim about predecessors, fallen troops disputed";"WASHINGTON (AP) - For U.S. presidents, meeting the families of military personnel killed in war is about as wrenching as the presidency gets. President..."
215;"AFL to decide if transgender player can take part in AFLW";"The AFL is set to make a historic ruling on whether a transgender player can take part in the AFL Women's competition. Hannah Mouncey has nominated for the draft after transitioning in 2015."
216;"US homebuilder sentiment rises in October";"U.S. homebuilders are feeling more optimistic than they have in months, looking past a recent slowdown in new home sales and the risk of rising labor and..."
217;"The Latest: US coalition: IS pockets remain in Syria's Raqqa";"BEIRUT (AP) - The Latest on developments in Syria as Islamic State militants make their last stand in the city of Raqqa (all times local):4:35 p.m.The..."
218;"AFL right to block transgender player from women's league";"A transgender activist believes the AFL were right in blocking transgender woman Hannah Mouncey from playing in the women's league."
219;"Meryl Streep reveals her beauty secret that costs nothing";"Meryl Streep reportedly refuses to touch her face as part of her beauty regime, says to journalist Fi Glover. Touching your face can spread bacteria and cause disease, doctors claim."
220;"Real Madrid fans see Harry Kane as the ultimate test";"Tottenham have never scored against Real Madrid in Europe but such has been the build-up Harry Kane has been given, there is a sense that will change on Tuesday night."
221;"Anthony Joshua to fight Carlos Takam as injury forces out Kubrat Pulev";"A shoulder injury has ruled out the 36-year-old Bulgarian."
222;"Napoli coach Maurizio Sarri has worked his way to the top";"Sarri's entire career in football has been about extracting the highest of standards from clubs with the smallest of reputations. Now he is determined to make his mark with Napoli."
223;"Israel advances plans for 1,292 West Bank settler homes in new push";"Israeli authorities advanced plans Tuesday for 1,292 settler homes in a new push by Prime Minister Benjamin Netanyahu's government to expand settlements in..."
224;"Bill Clinton mocks Brexit voters during speech in Ireland";"Bill Clinton spoke in Dublin on Tuesday as he received an honorary degree, warning against division in the world and holding up Brexit as an example of people focusing on differences."
225;"Brooklyn Beckham speeds around New York City on his bike";"The 18-year-old appeared to be enjoying a day off from his studies as he cruised around the Big Apple with ease - with his new tattoo tribute to his father David, visible on his left hand."
226;"The Only Way Is Essex: Megan McKenna flaunts legs";"The Only Way Is Essex star, 24, didn't let it show when she made a glamorous arrival at the Easilocks launch in London on Tuesday."
